{
  "schema_version": 1,
  "repo": "Vidocq/ravel",
  "branch": "main",
  "commit_sha": "7fe879be4c4b76b199a587453e3be5d887b8978a",
  "updated_at": "2026-10-21T14:15:24Z",
  "produces": [
    {
      "groupId": "io.vidocq.ravel",
      "artifactId": "ravel-api",
      "version": "0.4.0-SNAPSHOT"
    },
    {
      "groupId": "io.vidocq.ravel",
      "artifactId": "ravel-bench",
      "version": "0.4.0-SNAPSHOT"
    },
    {
      "groupId": "io.vidocq.ravel",
      "artifactId": "ravel-cdi-vauban",
      "version": "0.4.0-SNAPSHOT"
    },
    {
      "groupId": "io.vidocq.ravel",
      "artifactId": "ravel-core",
      "version": "0.4.0-SNAPSHOT"
    },
    {
      "groupId": "io.vidocq.ravel",
      "artifactId": "ravel-it-openliberty",
      "version": "0.4.0-SNAPSHOT"
    },
    {
      "groupId": "io.vidocq.ravel",
      "artifactId": "ravel-it-other-containers",
      "version": "0.4.0-SNAPSHOT"
    },
    {
      "groupId": "io.vidocq.ravel",
      "artifactId": "ravel-it-weld",
      "version": "0.4.0-SNAPSHOT"
    },
    {
      "groupId": "io.vidocq.ravel",
      "artifactId": "ravel-mp-config-api",
      "version": "0.4.0-SNAPSHOT"
    },
    {
      "groupId": "io.vidocq.ravel",
      "artifactId": "ravel-parent",
      "version": "0.4.0-SNAPSHOT"
    }
  ],
  "consumes": [
    {
      "groupId": "io.vidocq.vauban",
      "artifactId": "vauban-api",
      "version": "${vauban.version}",
      "scope": "provided",
      "type": "jar"
    },
    {
      "groupId": "io.vidocq.vauban",
      "artifactId": "vauban-classloader-spi",
      "version": "${vauban.version}",
      "scope": "test",
      "type": "jar"
    },
    {
      "groupId": "io.vidocq.vauban",
      "artifactId": "vauban-core",
      "version": "${vauban.version}",
      "scope": "test",
      "type": "jar"
    }
  ]
}
