{
  "schema_version": 1,
  "repo": "Vidocq/champollion",
  "branch": "main",
  "commit_sha": "e5cff42b46bff5cbb16572d0009ce4327cd6cfc3",
  "updated_at": "2026-10-21T14:45:14Z",
  "produces": [
    {
      "groupId": "io.vidocq.champollion",
      "artifactId": "champollion-api",
      "version": "0.4.0-SNAPSHOT"
    },
    {
      "groupId": "io.vidocq.champollion",
      "artifactId": "champollion-bench",
      "version": "0.4.0-SNAPSHOT"
    },
    {
      "groupId": "io.vidocq.champollion",
      "artifactId": "champollion-codegen-apt",
      "version": "0.4.0-SNAPSHOT"
    },
    {
      "groupId": "io.vidocq.champollion",
      "artifactId": "champollion-codegen-maven-plugin",
      "version": "0.4.0-SNAPSHOT"
    },
    {
      "groupId": "io.vidocq.champollion",
      "artifactId": "champollion-examples",
      "version": "0.4.0-SNAPSHOT"
    },
    {
      "groupId": "io.vidocq.champollion",
      "artifactId": "champollion-it-openliberty",
      "version": "0.4.0-SNAPSHOT"
    },
    {
      "groupId": "io.vidocq.champollion",
      "artifactId": "champollion-it-other-containers",
      "version": "0.4.0-SNAPSHOT"
    },
    {
      "groupId": "io.vidocq.champollion",
      "artifactId": "champollion-it-weld",
      "version": "0.4.0-SNAPSHOT"
    },
    {
      "groupId": "io.vidocq.champollion",
      "artifactId": "champollion-jsonb",
      "version": "0.4.0-SNAPSHOT"
    },
    {
      "groupId": "io.vidocq.champollion",
      "artifactId": "champollion-jsonp",
      "version": "0.4.0-SNAPSHOT"
    },
    {
      "groupId": "io.vidocq.champollion",
      "artifactId": "champollion-parent",
      "version": "0.4.0-SNAPSHOT"
    },
    {
      "groupId": "io.vidocq.champollion",
      "artifactId": "champollion-protobuf",
      "version": "0.4.0-SNAPSHOT"
    },
    {
      "groupId": "io.vidocq.champollion",
      "artifactId": "champollion-protobuf-codegen",
      "version": "0.4.0-SNAPSHOT"
    },
    {
      "groupId": "io.vidocq.champollion",
      "artifactId": "champollion-protobuf-maven-plugin",
      "version": "0.4.0-SNAPSHOT"
    }
  ],
  "consumes": []
}
