{
  "schema_version": 1,
  "repo": "Vidocq/mansart",
  "branch": "main",
  "commit_sha": "646094d7f00b68543874a72e5b91b01b4fe9ef36",
  "updated_at": "2026-10-21T13:49:56Z",
  "produces": [
    {
      "groupId": "io.vidocq.mansart",
      "artifactId": "mansart-data-cdi",
      "version": "0.4.0-SNAPSHOT"
    },
    {
      "groupId": "io.vidocq.mansart",
      "artifactId": "mansart-data-core",
      "version": "0.4.0-SNAPSHOT"
    },
    {
      "groupId": "io.vidocq.mansart",
      "artifactId": "mansart-data-dialect-h2",
      "version": "0.4.0-SNAPSHOT"
    },
    {
      "groupId": "io.vidocq.mansart",
      "artifactId": "mansart-data-dialect-postgresql",
      "version": "0.4.0-SNAPSHOT"
    },
    {
      "groupId": "io.vidocq.mansart",
      "artifactId": "mansart-data-dialect-spi",
      "version": "0.4.0-SNAPSHOT"
    },
    {
      "groupId": "io.vidocq.mansart",
      "artifactId": "mansart-data-dialects",
      "version": "0.4.0-SNAPSHOT"
    },
    {
      "groupId": "io.vidocq.mansart",
      "artifactId": "mansart-data-external-it",
      "version": "0.4.0-SNAPSHOT"
    },
    {
      "groupId": "io.vidocq.mansart",
      "artifactId": "mansart-data-external-lib",
      "version": "0.4.0-SNAPSHOT"
    },
    {
      "groupId": "io.vidocq.mansart",
      "artifactId": "mansart-data-maven-plugin",
      "version": "0.4.0-SNAPSHOT"
    },
    {
      "groupId": "io.vidocq.mansart",
      "artifactId": "mansart-data-processor",
      "version": "0.4.0-SNAPSHOT"
    },
    {
      "groupId": "io.vidocq.mansart",
      "artifactId": "mansart-data-tests",
      "version": "0.4.0-SNAPSHOT"
    },
    {
      "groupId": "io.vidocq.mansart",
      "artifactId": "mansart-jakarta-data",
      "version": "0.4.0-SNAPSHOT"
    },
    {
      "groupId": "io.vidocq.mansart",
      "artifactId": "mansart-pool",
      "version": "0.4.0-SNAPSHOT"
    },
    {
      "groupId": "io.vidocq.mansart",
      "artifactId": "mansart-pool-api",
      "version": "0.4.0-SNAPSHOT"
    },
    {
      "groupId": "io.vidocq.mansart",
      "artifactId": "mansart-pool-bench",
      "version": "0.4.0-SNAPSHOT"
    },
    {
      "groupId": "io.vidocq.mansart",
      "artifactId": "mansart-pool-core",
      "version": "0.4.0-SNAPSHOT"
    },
    {
      "groupId": "io.vidocq.mansart",
      "artifactId": "mansart-pool-tests",
      "version": "0.4.0-SNAPSHOT"
    },
    {
      "groupId": "io.vidocq.mansart",
      "artifactId": "mansart-root",
      "version": "0.4.0-SNAPSHOT"
    },
    {
      "groupId": "io.vidocq.mansart",
      "artifactId": "mansart-transactions",
      "version": "0.4.0-SNAPSHOT"
    },
    {
      "groupId": "io.vidocq.mansart",
      "artifactId": "mansart-transactions-api",
      "version": "0.4.0-SNAPSHOT"
    },
    {
      "groupId": "io.vidocq.mansart",
      "artifactId": "mansart-transactions-cdi",
      "version": "0.4.0-SNAPSHOT"
    },
    {
      "groupId": "io.vidocq.mansart",
      "artifactId": "mansart-transactions-cdi-module-it",
      "version": "0.4.0-SNAPSHOT"
    },
    {
      "groupId": "io.vidocq.mansart",
      "artifactId": "mansart-transactions-core",
      "version": "0.4.0-SNAPSHOT"
    },
    {
      "groupId": "io.vidocq.mansart",
      "artifactId": "mansart-transactions-jdbc",
      "version": "0.4.0-SNAPSHOT"
    },
    {
      "groupId": "io.vidocq.mansart",
      "artifactId": "mansart-transactions-tests",
      "version": "0.4.0-SNAPSHOT"
    }
  ],
  "consumes": [
    {
      "groupId": "io.vidocq.vauban",
      "artifactId": "vauban-api",
      "version": "0.4.0-SNAPSHOT",
      "scope": "provided",
      "type": "jar"
    },
    {
      "groupId": "io.vidocq.vauban",
      "artifactId": "vauban-classloader-spi",
      "version": "0.4.0-SNAPSHOT",
      "scope": "runtime",
      "type": "jar"
    },
    {
      "groupId": "io.vidocq.vauban",
      "artifactId": "vauban-classloader-spi",
      "version": "0.4.0-SNAPSHOT",
      "scope": "test",
      "type": "jar"
    },
    {
      "groupId": "io.vidocq.vauban",
      "artifactId": "vauban-core",
      "version": "0.4.0-SNAPSHOT",
      "scope": "compile",
      "type": "jar"
    },
    {
      "groupId": "io.vidocq.vauban",
      "artifactId": "vauban-core",
      "version": "0.4.0-SNAPSHOT",
      "scope": "test",
      "type": "jar"
    },
    {
      "groupId": "io.vidocq.vauban",
      "artifactId": "vauban-junit",
      "version": "0.4.0-SNAPSHOT",
      "scope": "test",
      "type": "jar"
    }
  ]
}
