{
  "schema_version": 1,
  "repo": "Vidocq/heisenberg",
  "branch": "main",
  "commit_sha": "183cf130642216ab2b41718da1c432c80b91829b",
  "updated_at": "2026-10-21T13:50:57Z",
  "produces": [
    {
      "groupId": "io.vidocq.heisenberg",
      "artifactId": "heisenberg-api",
      "version": "0.4.0-SNAPSHOT"
    },
    {
      "groupId": "io.vidocq.heisenberg",
      "artifactId": "heisenberg-bench",
      "version": "0.4.0-SNAPSHOT"
    },
    {
      "groupId": "io.vidocq.heisenberg",
      "artifactId": "heisenberg-cdi-vauban",
      "version": "0.4.0-SNAPSHOT"
    },
    {
      "groupId": "io.vidocq.heisenberg",
      "artifactId": "heisenberg-cdi-vauban-module-it",
      "version": "0.4.0-SNAPSHOT"
    },
    {
      "groupId": "io.vidocq.heisenberg",
      "artifactId": "heisenberg-core",
      "version": "0.4.0-SNAPSHOT"
    },
    {
      "groupId": "io.vidocq.heisenberg",
      "artifactId": "heisenberg-examples",
      "version": "0.4.0-SNAPSHOT"
    },
    {
      "groupId": "io.vidocq.heisenberg",
      "artifactId": "heisenberg-it-openliberty",
      "version": "0.4.0-SNAPSHOT"
    },
    {
      "groupId": "io.vidocq.heisenberg",
      "artifactId": "heisenberg-it-other-containers",
      "version": "0.4.0-SNAPSHOT"
    },
    {
      "groupId": "io.vidocq.heisenberg",
      "artifactId": "heisenberg-it-weld",
      "version": "0.4.0-SNAPSHOT"
    },
    {
      "groupId": "io.vidocq.heisenberg",
      "artifactId": "heisenberg-mp-ft-api",
      "version": "0.4.0-SNAPSHOT"
    },
    {
      "groupId": "io.vidocq.heisenberg",
      "artifactId": "heisenberg-parent",
      "version": "0.4.0-SNAPSHOT"
    }
  ],
  "consumes": [
    {
      "groupId": "io.vidocq.dirac",
      "artifactId": "dirac-mp-metrics-api",
      "version": "0.4.0-SNAPSHOT",
      "scope": "compile",
      "type": "jar"
    },
    {
      "groupId": "io.vidocq.dirac",
      "artifactId": "dirac-mp-metrics-api",
      "version": "",
      "scope": "provided",
      "type": "jar"
    },
    {
      "groupId": "io.vidocq.ravel",
      "artifactId": "ravel-core",
      "version": "0.4.0-SNAPSHOT",
      "scope": "compile",
      "type": "jar"
    },
    {
      "groupId": "io.vidocq.ravel",
      "artifactId": "ravel-core",
      "version": "${ravel.version}",
      "scope": "runtime",
      "type": "jar"
    },
    {
      "groupId": "io.vidocq.ravel",
      "artifactId": "ravel-core",
      "version": "",
      "scope": "test",
      "type": "jar"
    },
    {
      "groupId": "io.vidocq.ravel",
      "artifactId": "ravel-mp-config-api",
      "version": "0.4.0-SNAPSHOT",
      "scope": "compile",
      "type": "jar"
    },
    {
      "groupId": "io.vidocq.vauban",
      "artifactId": "vauban-api",
      "version": "${vauban.version}",
      "scope": "compile",
      "type": "jar"
    },
    {
      "groupId": "io.vidocq.vauban",
      "artifactId": "vauban-classloader-spi",
      "version": "0.4.0-SNAPSHOT",
      "scope": "compile",
      "type": "jar"
    },
    {
      "groupId": "io.vidocq.vauban",
      "artifactId": "vauban-classloader-spi",
      "version": "${vauban.version}",
      "scope": "runtime",
      "type": "jar"
    },
    {
      "groupId": "io.vidocq.vauban",
      "artifactId": "vauban-classloader-spi",
      "version": "",
      "scope": "test",
      "type": "jar"
    },
    {
      "groupId": "io.vidocq.vauban",
      "artifactId": "vauban-core",
      "version": "0.4.0-SNAPSHOT",
      "scope": "compile",
      "type": "jar"
    },
    {
      "groupId": "io.vidocq.vauban",
      "artifactId": "vauban-core",
      "version": "",
      "scope": "provided",
      "type": "jar"
    }
  ]
}
