{
  "schema_version": 1,
  "repo": "Vidocq/foy",
  "branch": "main",
  "commit_sha": "d96dbe6657e929efdcf79ad0118ff814ec51fc7b",
  "updated_at": "2026-10-11T10:21:47Z",
  "produces": [
    {
      "groupId": "io.vidocq.foy",
      "artifactId": "foy-api",
      "version": "0.4.0-SNAPSHOT"
    },
    {
      "groupId": "io.vidocq.foy",
      "artifactId": "foy-cdi-vauban",
      "version": "0.4.0-SNAPSHOT"
    },
    {
      "groupId": "io.vidocq.foy",
      "artifactId": "foy-chappe",
      "version": "0.4.0-SNAPSHOT"
    },
    {
      "groupId": "io.vidocq.foy",
      "artifactId": "foy-core",
      "version": "0.4.0-SNAPSHOT"
    },
    {
      "groupId": "io.vidocq.foy",
      "artifactId": "foy-it-other-containers",
      "version": "0.4.0-SNAPSHOT"
    },
    {
      "groupId": "io.vidocq.foy",
      "artifactId": "foy-it-session-scenarios",
      "version": "0.4.0-SNAPSHOT"
    },
    {
      "groupId": "io.vidocq.foy",
      "artifactId": "foy-it-vauban-session",
      "version": "0.4.0-SNAPSHOT"
    },
    {
      "groupId": "io.vidocq.foy",
      "artifactId": "foy-it-weld",
      "version": "0.4.0-SNAPSHOT"
    },
    {
      "groupId": "io.vidocq.foy",
      "artifactId": "foy-it-weld-servlet",
      "version": "0.4.0-SNAPSHOT"
    },
    {
      "groupId": "io.vidocq.foy",
      "artifactId": "foy-parent",
      "version": "0.4.0-SNAPSHOT"
    },
    {
      "groupId": "io.vidocq.foy",
      "artifactId": "foy-processor",
      "version": "0.4.0-SNAPSHOT"
    }
  ],
  "consumes": [
    {
      "groupId": "io.vidocq.chappe",
      "artifactId": "chappe-api",
      "version": "0.4.0-SNAPSHOT",
      "scope": "compile",
      "type": "jar"
    },
    {
      "groupId": "io.vidocq.chappe",
      "artifactId": "chappe-core",
      "version": "0.4.0-SNAPSHOT",
      "scope": "compile",
      "type": "jar"
    },
    {
      "groupId": "io.vidocq.chappe",
      "artifactId": "chappe-core",
      "version": "",
      "scope": "test",
      "type": "jar"
    },
    {
      "groupId": "io.vidocq.vauban",
      "artifactId": "vauban-api",
      "version": "0.4.0-SNAPSHOT",
      "scope": "compile",
      "type": "jar"
    },
    {
      "groupId": "io.vidocq.vauban",
      "artifactId": "vauban-core",
      "version": "0.4.0-SNAPSHOT",
      "scope": "compile",
      "type": "jar"
    },
    {
      "groupId": "io.vidocq.vauban",
      "artifactId": "vauban-processor",
      "version": "${vauban.version}",
      "scope": "test",
      "type": "jar"
    },
    {
      "groupId": "io.vidocq.vauban",
      "artifactId": "vauban-webcontexts",
      "version": "${vauban.version}",
      "scope": "compile",
      "type": "jar"
    }
  ]
}
