{
  "schema_version": 1,
  "repo": "Vidocq/tassis",
  "branch": "main",
  "commit_sha": "64a2c6e27ceae75f17650e8b97b135bb806af6da",
  "updated_at": "2026-10-12T17:02:28Z",
  "produces": [
    {
      "groupId": "io.vidocq.tassis",
      "artifactId": "tassis-amqp",
      "version": "0.4.0-SNAPSHOT"
    },
    {
      "groupId": "io.vidocq.tassis",
      "artifactId": "tassis-api",
      "version": "0.4.0-SNAPSHOT"
    },
    {
      "groupId": "io.vidocq.tassis",
      "artifactId": "tassis-cdi-vauban",
      "version": "0.4.0-SNAPSHOT"
    },
    {
      "groupId": "io.vidocq.tassis",
      "artifactId": "tassis-cdi-vauban-module-it",
      "version": "0.4.0-SNAPSHOT"
    },
    {
      "groupId": "io.vidocq.tassis",
      "artifactId": "tassis-core",
      "version": "0.4.0-SNAPSHOT"
    },
    {
      "groupId": "io.vidocq.tassis",
      "artifactId": "tassis-examples",
      "version": "0.4.0-SNAPSHOT"
    },
    {
      "groupId": "io.vidocq.tassis",
      "artifactId": "tassis-parent",
      "version": "0.4.0-SNAPSHOT"
    },
    {
      "groupId": "io.vidocq.tassis",
      "artifactId": "tassis-pool",
      "version": "0.4.0-SNAPSHOT"
    },
    {
      "groupId": "io.vidocq.tassis",
      "artifactId": "tassis-server",
      "version": "0.4.0-SNAPSHOT"
    }
  ],
  "consumes": [
    {
      "groupId": "io.vidocq.vauban",
      "artifactId": "vauban-api",
      "version": "0.4.0-SNAPSHOT",
      "scope": "compile",
      "type": "jar"
    },
    {
      "groupId": "io.vidocq.vauban",
      "artifactId": "vauban-api",
      "version": "",
      "scope": "provided",
      "type": "jar"
    },
    {
      "groupId": "io.vidocq.vauban",
      "artifactId": "vauban-classloader-spi",
      "version": "0.4.0-SNAPSHOT",
      "scope": "compile",
      "type": "jar"
    },
    {
      "groupId": "io.vidocq.vauban",
      "artifactId": "vauban-classloader-spi",
      "version": "",
      "scope": "runtime",
      "type": "jar"
    },
    {
      "groupId": "io.vidocq.vauban",
      "artifactId": "vauban-classloader-spi",
      "version": "",
      "scope": "test",
      "type": "jar"
    },
    {
      "groupId": "io.vidocq.vauban",
      "artifactId": "vauban-core",
      "version": "0.4.0-SNAPSHOT",
      "scope": "compile",
      "type": "jar"
    },
    {
      "groupId": "io.vidocq.vauban",
      "artifactId": "vauban-core",
      "version": "",
      "scope": "test",
      "type": "jar"
    }
  ]
}
