{
  "schema_version": 1,
  "repo": "Vidocq/peano",
  "branch": "main",
  "commit_sha": "2f847c84c37d0d69c61718ac538613bbd135ae83",
  "updated_at": "2026-10-11T13:52:28Z",
  "produces": [
    {
      "groupId": "io.vidocq.peano",
      "artifactId": "peano-api",
      "version": "0.4.0-SNAPSHOT"
    },
    {
      "groupId": "io.vidocq.peano",
      "artifactId": "peano-compiler",
      "version": "0.4.0-SNAPSHOT"
    },
    {
      "groupId": "io.vidocq.peano",
      "artifactId": "peano-core",
      "version": "0.4.0-SNAPSHOT"
    },
    {
      "groupId": "io.vidocq.peano",
      "artifactId": "peano-parent",
      "version": "0.4.0-SNAPSHOT"
    },
    {
      "groupId": "io.vidocq.peano",
      "artifactId": "peano-processor",
      "version": "0.4.0-SNAPSHOT"
    }
  ],
  "consumes": []
}
