{
  "schema_version": 1,
  "repo": "Vidocq/humboldt",
  "branch": "main",
  "commit_sha": "414911af17e2622f3eade3af2de75e3fcbf1eabc",
  "updated_at": "2026-10-30T15:08:10Z",
  "produces": [
    {
      "groupId": "io.vidocq.humboldt",
      "artifactId": "humboldt-api",
      "version": "0.4.0-SNAPSHOT"
    },
    {
      "groupId": "io.vidocq.humboldt",
      "artifactId": "humboldt-cdi",
      "version": "0.4.0-SNAPSHOT"
    },
    {
      "groupId": "io.vidocq.humboldt",
      "artifactId": "humboldt-context",
      "version": "0.4.0-SNAPSHOT"
    },
    {
      "groupId": "io.vidocq.humboldt",
      "artifactId": "humboldt-exporter-otlp-http",
      "version": "0.4.0-SNAPSHOT"
    },
    {
      "groupId": "io.vidocq.humboldt",
      "artifactId": "humboldt-it-openliberty",
      "version": "0.4.0-SNAPSHOT"
    },
    {
      "groupId": "io.vidocq.humboldt",
      "artifactId": "humboldt-it-other-containers",
      "version": "0.4.0-SNAPSHOT"
    },
    {
      "groupId": "io.vidocq.humboldt",
      "artifactId": "humboldt-it-weld",
      "version": "0.4.0-SNAPSHOT"
    },
    {
      "groupId": "io.vidocq.humboldt",
      "artifactId": "humboldt-otel-api",
      "version": "0.4.0-SNAPSHOT"
    },
    {
      "groupId": "io.vidocq.humboldt",
      "artifactId": "humboldt-otel-context",
      "version": "0.4.0-SNAPSHOT"
    },
    {
      "groupId": "io.vidocq.humboldt",
      "artifactId": "humboldt-otel-instrumentation-annotations",
      "version": "0.4.0-SNAPSHOT"
    },
    {
      "groupId": "io.vidocq.humboldt",
      "artifactId": "humboldt-otel-interop",
      "version": "0.4.0-SNAPSHOT"
    },
    {
      "groupId": "io.vidocq.humboldt",
      "artifactId": "humboldt-parent",
      "version": "0.4.0-SNAPSHOT"
    },
    {
      "groupId": "io.vidocq.humboldt",
      "artifactId": "humboldt-propagator-w3c",
      "version": "0.4.0-SNAPSHOT"
    },
    {
      "groupId": "io.vidocq.humboldt",
      "artifactId": "humboldt-rest",
      "version": "0.4.0-SNAPSHOT"
    },
    {
      "groupId": "io.vidocq.humboldt",
      "artifactId": "humboldt-runtime",
      "version": "0.4.0-SNAPSHOT"
    },
    {
      "groupId": "io.vidocq.humboldt",
      "artifactId": "humboldt-sdk-common",
      "version": "0.4.0-SNAPSHOT"
    },
    {
      "groupId": "io.vidocq.humboldt",
      "artifactId": "humboldt-sdk-log",
      "version": "0.4.0-SNAPSHOT"
    },
    {
      "groupId": "io.vidocq.humboldt",
      "artifactId": "humboldt-sdk-metric",
      "version": "0.4.0-SNAPSHOT"
    },
    {
      "groupId": "io.vidocq.humboldt",
      "artifactId": "humboldt-sdk-trace",
      "version": "0.4.0-SNAPSHOT"
    }
  ],
  "consumes": [
    {
      "groupId": "io.vidocq.cassini",
      "artifactId": "cassini-api",
      "version": "${cassini.version}",
      "scope": "provided",
      "type": "jar"
    },
    {
      "groupId": "io.vidocq.cassini",
      "artifactId": "cassini-processor",
      "version": "${cassini.version}",
      "scope": "build",
      "type": "jar"
    },
    {
      "groupId": "io.vidocq.cyrano",
      "artifactId": "cyrano-mp-rest-client-api",
      "version": "0.4.0-SNAPSHOT",
      "scope": "provided",
      "type": "jar"
    },
    {
      "groupId": "io.vidocq.vauban",
      "artifactId": "vauban-api",
      "version": "${vauban.version}",
      "scope": "compile",
      "type": "jar"
    },
    {
      "groupId": "io.vidocq.vauban",
      "artifactId": "vauban-api",
      "version": "${vauban.version}",
      "scope": "provided",
      "type": "jar"
    },
    {
      "groupId": "io.vidocq.vauban",
      "artifactId": "vauban-processor",
      "version": "${vauban.version}",
      "scope": "build",
      "type": "jar"
    }
  ]
}
