{
  "schema_version": 1,
  "repo": "Vidocq/grimm",
  "branch": "main",
  "commit_sha": "08e2dda4c9dcea714de5368cc03d53199bb3c690",
  "updated_at": "2026-10-24T21:50:56Z",
  "produces": [
    {
      "groupId": "io.vidocq.grimm",
      "artifactId": "grimm-bench",
      "version": "0.4.0-SNAPSHOT"
    },
    {
      "groupId": "io.vidocq.grimm",
      "artifactId": "grimm-cdi-vauban",
      "version": "0.4.0-SNAPSHOT"
    },
    {
      "groupId": "io.vidocq.grimm",
      "artifactId": "grimm-core",
      "version": "0.4.0-SNAPSHOT"
    },
    {
      "groupId": "io.vidocq.grimm",
      "artifactId": "grimm-examples",
      "version": "0.4.0-SNAPSHOT"
    },
    {
      "groupId": "io.vidocq.grimm",
      "artifactId": "grimm-it-openliberty",
      "version": "0.4.0-SNAPSHOT"
    },
    {
      "groupId": "io.vidocq.grimm",
      "artifactId": "grimm-it-other-containers",
      "version": "0.4.0-SNAPSHOT"
    },
    {
      "groupId": "io.vidocq.grimm",
      "artifactId": "grimm-it-weld",
      "version": "0.4.0-SNAPSHOT"
    },
    {
      "groupId": "io.vidocq.grimm",
      "artifactId": "grimm-parent",
      "version": "0.4.0-SNAPSHOT"
    },
    {
      "groupId": "io.vidocq.grimm",
      "artifactId": "grimm-processor",
      "version": "0.4.0-SNAPSHOT"
    }
  ],
  "consumes": [
    {
      "groupId": "io.vidocq.cassini",
      "artifactId": "cassini-chappe",
      "version": "${cassini.version}",
      "scope": "test",
      "type": "jar"
    },
    {
      "groupId": "io.vidocq.chappe",
      "artifactId": "chappe-api",
      "version": "${chappe.version}",
      "scope": "test",
      "type": "jar"
    },
    {
      "groupId": "io.vidocq.chappe",
      "artifactId": "chappe-core",
      "version": "${chappe.version}",
      "scope": "test",
      "type": "jar"
    },
    {
      "groupId": "io.vidocq.ravel",
      "artifactId": "ravel-core",
      "version": "${ravel.version}",
      "scope": "test",
      "type": "jar"
    },
    {
      "groupId": "io.vidocq.ravel",
      "artifactId": "ravel-mp-config-api",
      "version": "0.4.0-SNAPSHOT",
      "scope": "compile",
      "type": "jar"
    },
    {
      "groupId": "io.vidocq.ravel",
      "artifactId": "ravel-mp-config-api",
      "version": "",
      "scope": "provided",
      "type": "jar"
    },
    {
      "groupId": "io.vidocq.ravel",
      "artifactId": "ravel-mp-config-api",
      "version": "",
      "scope": "test",
      "type": "jar"
    },
    {
      "groupId": "io.vidocq.vauban",
      "artifactId": "vauban-api",
      "version": "${vauban.version}",
      "scope": "compile",
      "type": "jar"
    },
    {
      "groupId": "io.vidocq.vauban",
      "artifactId": "vauban-core",
      "version": "${vauban.version}",
      "scope": "test",
      "type": "jar"
    }
  ]
}
