{
  "schema_version": 1,
  "repo": "Vidocq/bodoni",
  "branch": "main",
  "commit_sha": "a6e1315fe663da6c9f401d4b880a493c29322ff6",
  "updated_at": "2026-10-24T00:52:19Z",
  "produces": [
    {
      "groupId": "io.vidocq.bodoni",
      "artifactId": "bodoni-core",
      "version": "0.4.0-SNAPSHOT"
    },
    {
      "groupId": "io.vidocq.bodoni",
      "artifactId": "bodoni-parent",
      "version": "0.4.0-SNAPSHOT"
    },
    {
      "groupId": "io.vidocq.bodoni",
      "artifactId": "bodoni-peano",
      "version": "0.4.0-SNAPSHOT"
    }
  ],
  "consumes": [
    {
      "groupId": "io.vidocq.peano",
      "artifactId": "peano-api",
      "version": "0.4.0-SNAPSHOT",
      "scope": "compile",
      "type": "jar"
    },
    {
      "groupId": "io.vidocq.peano",
      "artifactId": "peano-core",
      "version": "0.4.0-SNAPSHOT",
      "scope": "compile",
      "type": "jar"
    },
    {
      "groupId": "io.vidocq.peano",
      "artifactId": "peano-core",
      "version": "",
      "scope": "test",
      "type": "jar"
    }
  ]
}
