{
  "schema_version": 1,
  "repo": "Vidocq/knock",
  "branch": "main",
  "commit_sha": "e705e3ed816d2ffbb07cd0622598f55ae586f67b",
  "updated_at": "2026-10-21T13:48:01Z",
  "produces": [
    {
      "groupId": "io.vidocq.knock",
      "artifactId": "knock-api",
      "version": "0.4.0-SNAPSHOT"
    },
    {
      "groupId": "io.vidocq.knock",
      "artifactId": "knock-cdi-vauban",
      "version": "0.4.0-SNAPSHOT"
    },
    {
      "groupId": "io.vidocq.knock",
      "artifactId": "knock-core",
      "version": "0.4.0-SNAPSHOT"
    },
    {
      "groupId": "io.vidocq.knock",
      "artifactId": "knock-it-openliberty",
      "version": "0.4.0-SNAPSHOT"
    },
    {
      "groupId": "io.vidocq.knock",
      "artifactId": "knock-it-other-containers",
      "version": "0.4.0-SNAPSHOT"
    },
    {
      "groupId": "io.vidocq.knock",
      "artifactId": "knock-it-weld",
      "version": "0.4.0-SNAPSHOT"
    },
    {
      "groupId": "io.vidocq.knock",
      "artifactId": "knock-jaxrs",
      "version": "0.4.0-SNAPSHOT"
    },
    {
      "groupId": "io.vidocq.knock",
      "artifactId": "knock-mp-health-api",
      "version": "0.4.0-SNAPSHOT"
    },
    {
      "groupId": "io.vidocq.knock",
      "artifactId": "knock-parent",
      "version": "0.4.0-SNAPSHOT"
    }
  ],
  "consumes": [
    {
      "groupId": "io.vidocq.cassini",
      "artifactId": "cassini-api",
      "version": "${cassini.version}",
      "scope": "provided",
      "type": "jar"
    },
    {
      "groupId": "io.vidocq.cassini",
      "artifactId": "cassini-core",
      "version": "0.4.0-SNAPSHOT",
      "scope": "compile",
      "type": "jar"
    },
    {
      "groupId": "io.vidocq.cassini",
      "artifactId": "cassini-core",
      "version": "",
      "scope": "test",
      "type": "jar"
    },
    {
      "groupId": "io.vidocq.champollion",
      "artifactId": "champollion-jsonp",
      "version": "0.4.0-SNAPSHOT",
      "scope": "compile",
      "type": "jar"
    },
    {
      "groupId": "io.vidocq.champollion",
      "artifactId": "champollion-jsonp",
      "version": "",
      "scope": "test",
      "type": "jar"
    },
    {
      "groupId": "io.vidocq.vauban",
      "artifactId": "vauban-api",
      "version": "0.4.0-SNAPSHOT",
      "scope": "compile",
      "type": "jar"
    },
    {
      "groupId": "io.vidocq.vauban",
      "artifactId": "vauban-classloader-spi",
      "version": "0.4.0-SNAPSHOT",
      "scope": "compile",
      "type": "jar"
    },
    {
      "groupId": "io.vidocq.vauban",
      "artifactId": "vauban-classloader-spi",
      "version": "",
      "scope": "test",
      "type": "jar"
    },
    {
      "groupId": "io.vidocq.vauban",
      "artifactId": "vauban-core",
      "version": "0.4.0-SNAPSHOT",
      "scope": "compile",
      "type": "jar"
    },
    {
      "groupId": "io.vidocq.vauban",
      "artifactId": "vauban-core",
      "version": "",
      "scope": "test",
      "type": "jar"
    }
  ]
}
