{
  "schema_version": 1,
  "repo": "Vidocq/erasmus",
  "branch": "main",
  "commit_sha": "f4a0a9f1d3f72be38d6b1ecfd62cb39245895769",
  "updated_at": "2026-09-10T15:08:37Z",
  "produces": [
    {
      "groupId": "io.vidocq.erasmus",
      "artifactId": "erasmus-api",
      "version": "0.3.0-SNAPSHOT"
    },
    {
      "groupId": "io.vidocq.erasmus",
      "artifactId": "erasmus-bench",
      "version": "0.3.0-SNAPSHOT"
    },
    {
      "groupId": "io.vidocq.erasmus",
      "artifactId": "erasmus-cdi-vauban",
      "version": "0.3.0-SNAPSHOT"
    },
    {
      "groupId": "io.vidocq.erasmus",
      "artifactId": "erasmus-codegen-apt",
      "version": "0.3.0-SNAPSHOT"
    },
    {
      "groupId": "io.vidocq.erasmus",
      "artifactId": "erasmus-codegen-maven-plugin",
      "version": "0.3.0-SNAPSHOT"
    },
    {
      "groupId": "io.vidocq.erasmus",
      "artifactId": "erasmus-core",
      "version": "0.3.0-SNAPSHOT"
    },
    {
      "groupId": "io.vidocq.erasmus",
      "artifactId": "erasmus-examples",
      "version": "0.3.0-SNAPSHOT"
    },
    {
      "groupId": "io.vidocq.erasmus",
      "artifactId": "erasmus-jaxrs",
      "version": "0.3.0-SNAPSHOT"
    },
    {
      "groupId": "io.vidocq.erasmus",
      "artifactId": "erasmus-parent",
      "version": "0.3.0-SNAPSHOT"
    }
  ],
  "consumes": [
    {
      "groupId": "io.vidocq.cassini",
      "artifactId": "cassini-core",
      "version": "0.4.0-SNAPSHOT",
      "scope": "compile",
      "type": "jar"
    },
    {
      "groupId": "io.vidocq.champollion",
      "artifactId": "champollion-jsonp",
      "version": "0.4.0-SNAPSHOT",
      "scope": "compile",
      "type": "jar"
    },
    {
      "groupId": "io.vidocq.vauban",
      "artifactId": "vauban-api",
      "version": "0.4.0-SNAPSHOT",
      "scope": "compile",
      "type": "jar"
    },
    {
      "groupId": "io.vidocq.vauban",
      "artifactId": "vauban-classloader-spi",
      "version": "0.4.0-SNAPSHOT",
      "scope": "compile",
      "type": "jar"
    },
    {
      "groupId": "io.vidocq.vauban",
      "artifactId": "vauban-core",
      "version": "0.4.0-SNAPSHOT",
      "scope": "compile",
      "type": "jar"
    }
  ]
}
