{
  "schema_version": 1,
  "repo": "Vidocq/dirac",
  "branch": "main",
  "commit_sha": "e99af365c81b586f616674eb3563d114ef831a66",
  "updated_at": "2026-10-21T14:15:25Z",
  "produces": [
    {
      "groupId": "io.vidocq.dirac",
      "artifactId": "dirac-api",
      "version": "0.4.0-SNAPSHOT"
    },
    {
      "groupId": "io.vidocq.dirac",
      "artifactId": "dirac-bench",
      "version": "0.4.0-SNAPSHOT"
    },
    {
      "groupId": "io.vidocq.dirac",
      "artifactId": "dirac-cdi-vauban",
      "version": "0.4.0-SNAPSHOT"
    },
    {
      "groupId": "io.vidocq.dirac",
      "artifactId": "dirac-cdi-vauban-module-it",
      "version": "0.4.0-SNAPSHOT"
    },
    {
      "groupId": "io.vidocq.dirac",
      "artifactId": "dirac-core",
      "version": "0.4.0-SNAPSHOT"
    },
    {
      "groupId": "io.vidocq.dirac",
      "artifactId": "dirac-examples",
      "version": "0.4.0-SNAPSHOT"
    },
    {
      "groupId": "io.vidocq.dirac",
      "artifactId": "dirac-it-openliberty",
      "version": "0.4.0-SNAPSHOT"
    },
    {
      "groupId": "io.vidocq.dirac",
      "artifactId": "dirac-it-other-containers",
      "version": "0.4.0-SNAPSHOT"
    },
    {
      "groupId": "io.vidocq.dirac",
      "artifactId": "dirac-it-weld",
      "version": "0.4.0-SNAPSHOT"
    },
    {
      "groupId": "io.vidocq.dirac",
      "artifactId": "dirac-mp-metrics-api",
      "version": "0.4.0-SNAPSHOT"
    },
    {
      "groupId": "io.vidocq.dirac",
      "artifactId": "dirac-parent",
      "version": "0.4.0-SNAPSHOT"
    },
    {
      "groupId": "io.vidocq.dirac",
      "artifactId": "dirac-processor",
      "version": "0.4.0-SNAPSHOT"
    },
    {
      "groupId": "io.vidocq.dirac",
      "artifactId": "dirac-rest",
      "version": "0.4.0-SNAPSHOT"
    }
  ],
  "consumes": [
    {
      "groupId": "io.vidocq.cassini",
      "artifactId": "cassini-api",
      "version": "${cassini.version}",
      "scope": "provided",
      "type": "jar"
    },
    {
      "groupId": "io.vidocq.ravel",
      "artifactId": "ravel-core",
      "version": "0.4.0-SNAPSHOT",
      "scope": "compile",
      "type": "jar"
    },
    {
      "groupId": "io.vidocq.vauban",
      "artifactId": "vauban-api",
      "version": "0.4.0-SNAPSHOT",
      "scope": "compile",
      "type": "jar"
    },
    {
      "groupId": "io.vidocq.vauban",
      "artifactId": "vauban-classloader-spi",
      "version": "0.4.0-SNAPSHOT",
      "scope": "compile",
      "type": "jar"
    },
    {
      "groupId": "io.vidocq.vauban",
      "artifactId": "vauban-classloader-spi",
      "version": "${vauban.version}",
      "scope": "runtime",
      "type": "jar"
    },
    {
      "groupId": "io.vidocq.vauban",
      "artifactId": "vauban-classloader-spi",
      "version": "",
      "scope": "test",
      "type": "jar"
    },
    {
      "groupId": "io.vidocq.vauban",
      "artifactId": "vauban-core",
      "version": "0.4.0-SNAPSHOT",
      "scope": "compile",
      "type": "jar"
    },
    {
      "groupId": "io.vidocq.vauban",
      "artifactId": "vauban-core",
      "version": "",
      "scope": "test",
      "type": "jar"
    }
  ]
}
