{
  "schema_version": 1,
  "repo": "Vidocq/cassini",
  "branch": "main",
  "commit_sha": "67a1e0966f35938b89796a08b1e05e7b52b18164",
  "updated_at": "2026-10-29T00:06:32Z",
  "produces": [
    {
      "groupId": "io.vidocq.cassini",
      "artifactId": "cassini-api",
      "version": "0.4.0-SNAPSHOT"
    },
    {
      "groupId": "io.vidocq.cassini",
      "artifactId": "cassini-cdi",
      "version": "0.4.0-SNAPSHOT"
    },
    {
      "groupId": "io.vidocq.cassini",
      "artifactId": "cassini-cdi-vauban",
      "version": "0.4.0-SNAPSHOT"
    },
    {
      "groupId": "io.vidocq.cassini",
      "artifactId": "cassini-chappe",
      "version": "0.4.0-SNAPSHOT"
    },
    {
      "groupId": "io.vidocq.cassini",
      "artifactId": "cassini-client",
      "version": "0.4.0-SNAPSHOT"
    },
    {
      "groupId": "io.vidocq.cassini",
      "artifactId": "cassini-core",
      "version": "0.4.0-SNAPSHOT"
    },
    {
      "groupId": "io.vidocq.cassini",
      "artifactId": "cassini-examples",
      "version": "0.4.0-SNAPSHOT"
    },
    {
      "groupId": "io.vidocq.cassini",
      "artifactId": "cassini-examples-chappe",
      "version": "0.4.0-SNAPSHOT"
    },
    {
      "groupId": "io.vidocq.cassini",
      "artifactId": "cassini-examples-jdkhttp",
      "version": "0.4.0-SNAPSHOT"
    },
    {
      "groupId": "io.vidocq.cassini",
      "artifactId": "cassini-examples-vauban",
      "version": "0.4.0-SNAPSHOT"
    },
    {
      "groupId": "io.vidocq.cassini",
      "artifactId": "cassini-it-other-containers",
      "version": "0.4.0-SNAPSHOT"
    },
    {
      "groupId": "io.vidocq.cassini",
      "artifactId": "cassini-it-weld",
      "version": "0.4.0-SNAPSHOT"
    },
    {
      "groupId": "io.vidocq.cassini",
      "artifactId": "cassini-jdk-http",
      "version": "0.4.0-SNAPSHOT"
    },
    {
      "groupId": "io.vidocq.cassini",
      "artifactId": "cassini-maven-plugin",
      "version": "0.4.0-SNAPSHOT"
    },
    {
      "groupId": "io.vidocq.cassini",
      "artifactId": "cassini-parent",
      "version": "0.4.0-SNAPSHOT"
    },
    {
      "groupId": "io.vidocq.cassini",
      "artifactId": "cassini-processor",
      "version": "0.4.0-SNAPSHOT"
    },
    {
      "groupId": "io.vidocq.cassini",
      "artifactId": "cassini-testing",
      "version": "0.4.0-SNAPSHOT"
    }
  ],
  "consumes": [
    {
      "groupId": "io.vidocq.champollion",
      "artifactId": "champollion-api",
      "version": "0.4.0-SNAPSHOT",
      "scope": "compile",
      "type": "jar"
    },
    {
      "groupId": "io.vidocq.champollion",
      "artifactId": "champollion-jsonb",
      "version": "0.4.0-SNAPSHOT",
      "scope": "compile",
      "type": "jar"
    },
    {
      "groupId": "io.vidocq.champollion",
      "artifactId": "champollion-jsonb",
      "version": "",
      "scope": "test",
      "type": "jar"
    },
    {
      "groupId": "io.vidocq.champollion",
      "artifactId": "champollion-jsonp",
      "version": "0.4.0-SNAPSHOT",
      "scope": "compile",
      "type": "jar"
    },
    {
      "groupId": "io.vidocq.champollion",
      "artifactId": "champollion-jsonp",
      "version": "",
      "scope": "test",
      "type": "jar"
    },
    {
      "groupId": "io.vidocq.chappe",
      "artifactId": "chappe-api",
      "version": "0.4.0-SNAPSHOT",
      "scope": "compile",
      "type": "jar"
    },
    {
      "groupId": "io.vidocq.chappe",
      "artifactId": "chappe-core",
      "version": "0.4.0-SNAPSHOT",
      "scope": "compile",
      "type": "jar"
    },
    {
      "groupId": "io.vidocq.chappe",
      "artifactId": "chappe-core",
      "version": "",
      "scope": "runtime",
      "type": "jar"
    },
    {
      "groupId": "io.vidocq.chappe",
      "artifactId": "chappe-core",
      "version": "",
      "scope": "test",
      "type": "jar"
    },
    {
      "groupId": "io.vidocq.ravel",
      "artifactId": "ravel-api",
      "version": "0.4.0-SNAPSHOT",
      "scope": "compile",
      "type": "jar"
    },
    {
      "groupId": "io.vidocq.ravel",
      "artifactId": "ravel-cdi-vauban",
      "version": "${ravel.version}",
      "scope": "build",
      "type": "jar"
    },
    {
      "groupId": "io.vidocq.ravel",
      "artifactId": "ravel-cdi-vauban",
      "version": "0.4.0-SNAPSHOT",
      "scope": "compile",
      "type": "jar"
    },
    {
      "groupId": "io.vidocq.ravel",
      "artifactId": "ravel-core",
      "version": "0.4.0-SNAPSHOT",
      "scope": "compile",
      "type": "jar"
    },
    {
      "groupId": "io.vidocq.vauban",
      "artifactId": "vauban-api",
      "version": "0.4.0-SNAPSHOT",
      "scope": "compile",
      "type": "jar"
    },
    {
      "groupId": "io.vidocq.vauban",
      "artifactId": "vauban-classloader-spi",
      "version": "${vauban.version}",
      "scope": "runtime",
      "type": "jar"
    },
    {
      "groupId": "io.vidocq.vauban",
      "artifactId": "vauban-core",
      "version": "0.4.0-SNAPSHOT",
      "scope": "compile",
      "type": "jar"
    },
    {
      "groupId": "io.vidocq.vauban",
      "artifactId": "vauban-processor",
      "version": "${vauban.version}",
      "scope": "build",
      "type": "jar"
    }
  ]
}
