{
  "schema_version": 1,
  "repo": "Vidocq/verne",
  "branch": "main",
  "commit_sha": "4c8e6d0554173d3dc218ef8f880433956778eead",
  "updated_at": "2026-10-22T10:45:19Z",
  "produces": [
    {
      "groupId": "io.vidocq.verne",
      "artifactId": "verne-parent",
      "version": "0.4.0-SNAPSHOT"
    }
  ],
  "consumes": []
}
