{
  "schema_version": 1,
  "repo": "Vidocq/ibarra",
  "branch": "main",
  "commit_sha": "45301f2daf9510838c3c65364df9b2e6246a0b69",
  "updated_at": "2026-10-11T11:00:49Z",
  "produces": [
    {
      "groupId": "io.vidocq.ibarra",
      "artifactId": "ibarra-api",
      "version": "0.4.0-SNAPSHOT"
    },
    {
      "groupId": "io.vidocq.ibarra",
      "artifactId": "ibarra-compiler",
      "version": "0.4.0-SNAPSHOT"
    },
    {
      "groupId": "io.vidocq.ibarra",
      "artifactId": "ibarra-core",
      "version": "0.4.0-SNAPSHOT"
    },
    {
      "groupId": "io.vidocq.ibarra",
      "artifactId": "ibarra-foy",
      "version": "0.4.0-SNAPSHOT"
    },
    {
      "groupId": "io.vidocq.ibarra",
      "artifactId": "ibarra-maven-plugin",
      "version": "0.4.0-SNAPSHOT"
    },
    {
      "groupId": "io.vidocq.ibarra",
      "artifactId": "ibarra-parent",
      "version": "0.4.0-SNAPSHOT"
    }
  ],
  "consumes": [
    {
      "groupId": "io.vidocq.chappe",
      "artifactId": "chappe-core",
      "version": "${chappe.version}",
      "scope": "test",
      "type": "jar"
    },
    {
      "groupId": "io.vidocq.foy",
      "artifactId": "foy-api",
      "version": "0.4.0-SNAPSHOT",
      "scope": "compile",
      "type": "jar"
    },
    {
      "groupId": "io.vidocq.foy",
      "artifactId": "foy-core",
      "version": "0.4.0-SNAPSHOT",
      "scope": "compile",
      "type": "jar"
    },
    {
      "groupId": "io.vidocq.foy",
      "artifactId": "foy-core",
      "version": "",
      "scope": "test",
      "type": "jar"
    },
    {
      "groupId": "io.vidocq.peano",
      "artifactId": "peano-core",
      "version": "0.4.0-SNAPSHOT",
      "scope": "compile",
      "type": "jar"
    },
    {
      "groupId": "io.vidocq.peano",
      "artifactId": "peano-core",
      "version": "",
      "scope": "test",
      "type": "jar"
    }
  ]
}
