{
  "schema_version": 1,
  "repo": "Vidocq/chappe",
  "branch": "main",
  "commit_sha": "177441ce3b1860f3a7143887acae13457c8bda91",
  "updated_at": "2026-10-21T23:04:02Z",
  "produces": [
    {
      "groupId": "io.vidocq.chappe",
      "artifactId": "chappe-api",
      "version": "0.4.0-SNAPSHOT"
    },
    {
      "groupId": "io.vidocq.chappe",
      "artifactId": "chappe-bench",
      "version": "0.4.0-SNAPSHOT"
    },
    {
      "groupId": "io.vidocq.chappe",
      "artifactId": "chappe-cli",
      "version": "0.4.0-SNAPSHOT"
    },
    {
      "groupId": "io.vidocq.chappe",
      "artifactId": "chappe-conformance",
      "version": "0.4.0-SNAPSHOT"
    },
    {
      "groupId": "io.vidocq.chappe",
      "artifactId": "chappe-core",
      "version": "0.4.0-SNAPSHOT"
    },
    {
      "groupId": "io.vidocq.chappe",
      "artifactId": "chappe-examples",
      "version": "0.4.0-SNAPSHOT"
    },
    {
      "groupId": "io.vidocq.chappe",
      "artifactId": "chappe-http",
      "version": "0.4.0-SNAPSHOT"
    },
    {
      "groupId": "io.vidocq.chappe",
      "artifactId": "chappe-parent",
      "version": "0.4.0-SNAPSHOT"
    },
    {
      "groupId": "io.vidocq.chappe",
      "artifactId": "chappe-static-index-maven-plugin",
      "version": "0.4.0-SNAPSHOT"
    },
    {
      "groupId": "io.vidocq.chappe",
      "artifactId": "chappe-tests",
      "version": "0.4.0-SNAPSHOT"
    }
  ],
  "consumes": []
}
