{
  "schema_version": 1,
  "repo": "Vidocq/vauban",
  "branch": "main",
  "commit_sha": "4195ed695879e77f8d928d087c642d33977e728c",
  "updated_at": "2026-10-22T22:55:58Z",
  "produces": [
    {
      "groupId": "io.vidocq.vauban",
      "artifactId": "example-app",
      "version": "0.4.0-SNAPSHOT"
    },
    {
      "groupId": "io.vidocq.vauban",
      "artifactId": "example-cdi1015-app",
      "version": "0.4.0-SNAPSHOT"
    },
    {
      "groupId": "io.vidocq.vauban",
      "artifactId": "example-cdi1015-lib",
      "version": "0.4.0-SNAPSHOT"
    },
    {
      "groupId": "io.vidocq.vauban",
      "artifactId": "example-enhanced-app",
      "version": "0.4.0-SNAPSHOT"
    },
    {
      "groupId": "io.vidocq.vauban",
      "artifactId": "example-legacy-app",
      "version": "0.4.0-SNAPSHOT"
    },
    {
      "groupId": "io.vidocq.vauban",
      "artifactId": "example-legacy-lib",
      "version": "0.4.0-SNAPSHOT"
    },
    {
      "groupId": "io.vidocq.vauban",
      "artifactId": "example-lib",
      "version": "0.4.0-SNAPSHOT"
    },
    {
      "groupId": "io.vidocq.vauban",
      "artifactId": "example-lib-securized",
      "version": "0.4.0-SNAPSHOT"
    },
    {
      "groupId": "io.vidocq.vauban",
      "artifactId": "example-test",
      "version": "0.4.0-SNAPSHOT"
    },
    {
      "groupId": "io.vidocq.vauban",
      "artifactId": "vauban-api",
      "version": "0.4.0-SNAPSHOT"
    },
    {
      "groupId": "io.vidocq.vauban",
      "artifactId": "vauban-atinject-tck-runner",
      "version": "0.4.0-SNAPSHOT"
    },
    {
      "groupId": "io.vidocq.vauban",
      "artifactId": "vauban-bench",
      "version": "0.4.0-SNAPSHOT"
    },
    {
      "groupId": "io.vidocq.vauban",
      "artifactId": "vauban-classloader",
      "version": "0.4.0-SNAPSHOT"
    },
    {
      "groupId": "io.vidocq.vauban",
      "artifactId": "vauban-classloader-spi",
      "version": "0.4.0-SNAPSHOT"
    },
    {
      "groupId": "io.vidocq.vauban",
      "artifactId": "vauban-core",
      "version": "0.4.0-SNAPSHOT"
    },
    {
      "groupId": "io.vidocq.vauban",
      "artifactId": "vauban-examples",
      "version": "0.4.0-SNAPSHOT"
    },
    {
      "groupId": "io.vidocq.vauban",
      "artifactId": "vauban-indexer",
      "version": "0.4.0-SNAPSHOT"
    },
    {
      "groupId": "io.vidocq.vauban",
      "artifactId": "vauban-junit",
      "version": "0.4.0-SNAPSHOT"
    },
    {
      "groupId": "io.vidocq.vauban",
      "artifactId": "vauban-maven-plugin",
      "version": "0.4.0-SNAPSHOT"
    },
    {
      "groupId": "io.vidocq.vauban",
      "artifactId": "vauban-module-it",
      "version": "0.4.0-SNAPSHOT"
    },
    {
      "groupId": "io.vidocq.vauban",
      "artifactId": "vauban-naming",
      "version": "0.4.0-SNAPSHOT"
    },
    {
      "groupId": "io.vidocq.vauban",
      "artifactId": "vauban-parent",
      "version": "0.4.0-SNAPSHOT"
    },
    {
      "groupId": "io.vidocq.vauban",
      "artifactId": "vauban-processor",
      "version": "0.4.0-SNAPSHOT"
    },
    {
      "groupId": "io.vidocq.vauban",
      "artifactId": "vauban-producer-it-bean-b",
      "version": "0.4.0-SNAPSHOT"
    },
    {
      "groupId": "io.vidocq.vauban",
      "artifactId": "vauban-producer-it-lib-a",
      "version": "0.4.0-SNAPSHOT"
    },
    {
      "groupId": "io.vidocq.vauban",
      "artifactId": "vauban-producer-module-it",
      "version": "0.4.0-SNAPSHOT"
    },
    {
      "groupId": "io.vidocq.vauban",
      "artifactId": "vauban-sjar",
      "version": "0.4.0-SNAPSHOT"
    },
    {
      "groupId": "io.vidocq.vauban",
      "artifactId": "vauban-tck-runner",
      "version": "0.4.0-SNAPSHOT"
    },
    {
      "groupId": "io.vidocq.vauban",
      "artifactId": "vauban-weaver",
      "version": "0.4.0-SNAPSHOT"
    },
    {
      "groupId": "io.vidocq.vauban",
      "artifactId": "vauban-webcontexts",
      "version": "0.4.0-SNAPSHOT"
    }
  ],
  "consumes": []
}
