{
  "schema_version": 1,
  "repo": "Vidocq/noether",
  "branch": "main",
  "commit_sha": "a5277dc59f9f454f43395b4f0384ed0afa55248e",
  "updated_at": "2026-10-15T16:15:18Z",
  "produces": [
    {
      "groupId": "io.vidocq.noether",
      "artifactId": "noether-jpa",
      "version": "0.4.0-SNAPSHOT"
    },
    {
      "groupId": "io.vidocq.noether",
      "artifactId": "noether-jpa-cdi",
      "version": "0.4.0-SNAPSHOT"
    },
    {
      "groupId": "io.vidocq.noether",
      "artifactId": "noether-jpa-cdi-module-it",
      "version": "0.4.0-SNAPSHOT"
    },
    {
      "groupId": "io.vidocq.noether",
      "artifactId": "noether-jpa-core",
      "version": "0.4.0-SNAPSHOT"
    },
    {
      "groupId": "io.vidocq.noether",
      "artifactId": "noether-jpa-dialect-h2",
      "version": "0.4.0-SNAPSHOT"
    },
    {
      "groupId": "io.vidocq.noether",
      "artifactId": "noether-jpa-dialect-postgresql",
      "version": "0.4.0-SNAPSHOT"
    },
    {
      "groupId": "io.vidocq.noether",
      "artifactId": "noether-jpa-dialect-spi",
      "version": "0.4.0-SNAPSHOT"
    },
    {
      "groupId": "io.vidocq.noether",
      "artifactId": "noether-jpa-dialects",
      "version": "0.4.0-SNAPSHOT"
    },
    {
      "groupId": "io.vidocq.noether",
      "artifactId": "noether-jpa-module-it",
      "version": "0.4.0-SNAPSHOT"
    },
    {
      "groupId": "io.vidocq.noether",
      "artifactId": "noether-jpa-processor",
      "version": "0.4.0-SNAPSHOT"
    },
    {
      "groupId": "io.vidocq.noether",
      "artifactId": "noether-jpa-processor-module-it",
      "version": "0.4.0-SNAPSHOT"
    },
    {
      "groupId": "io.vidocq.noether",
      "artifactId": "noether-root",
      "version": "0.4.0-SNAPSHOT"
    },
    {
      "groupId": "io.vidocq.noether",
      "artifactId": "noether-validation",
      "version": "0.4.0-SNAPSHOT"
    },
    {
      "groupId": "io.vidocq.noether",
      "artifactId": "noether-validation-core",
      "version": "0.4.0-SNAPSHOT"
    },
    {
      "groupId": "io.vidocq.noether",
      "artifactId": "noether-validation-core-module-it",
      "version": "0.4.0-SNAPSHOT"
    }
  ],
  "consumes": [
    {
      "groupId": "io.vidocq.mansart",
      "artifactId": "mansart-data-dialect-spi",
      "version": "${mansart.version}",
      "scope": "compile",
      "type": "jar"
    },
    {
      "groupId": "io.vidocq.mansart",
      "artifactId": "mansart-pool-core",
      "version": "${mansart.version}",
      "scope": "compile",
      "type": "jar"
    },
    {
      "groupId": "io.vidocq.mansart",
      "artifactId": "mansart-transactions-core",
      "version": "${mansart.version}",
      "scope": "compile",
      "type": "jar"
    },
    {
      "groupId": "io.vidocq.mansart",
      "artifactId": "mansart-transactions-jdbc",
      "version": "${mansart.version}",
      "scope": "compile",
      "type": "jar"
    },
    {
      "groupId": "io.vidocq.vauban",
      "artifactId": "vauban-classloader-spi",
      "version": "0.4.0-SNAPSHOT",
      "scope": "runtime",
      "type": "jar"
    },
    {
      "groupId": "io.vidocq.vauban",
      "artifactId": "vauban-core",
      "version": "0.4.0-SNAPSHOT",
      "scope": "compile",
      "type": "jar"
    }
  ]
}
